<?xml version="1.0" encoding="UTF-8"?>
<!DOCTYPE master SYSTEM "exemple.dtd">

<master>

	<intervenant id='I1'>
		<nom>Bertrand</nom>
		<mail>bertrand@sfr.fr</mail>
		<site>bertrand.fr</site>
	</intervenant>

	<intervenant id='I2'>
		<nom>Jacques</nom>
		<mail>Jacques@sfr.fr</mail>
		<site>Jacques.fr</site>
	</intervenant>

	<intervenant id='I3'>
		<nom>Henry</nom>
		<mail>henry@sfr.fr</mail>
		<site>henry.fr</site>
	</intervenant>

	<parcours>
		<responsable></responsable>
		<responsable></responsable>
		<nom></nom>
		<description></description>
		<debouche></debouche>
		<ref-semestre ref=''/>
	</parcours>

	<parcours>
		<responsable></responsable>
		<responsable></responsable>
		<nom></nom>
		<description></description>
		<debouche></debouche>
		<ref-semestre ref=''/>
	</parcours>
	<!ELEMENT semestre         ( (ref-unite, role)* )>

	<semestre id='S1'>
		<ref-unite ref='S51AN1M1' role='' />
		<ref-unite ref='S51IN1M1' role='' />
		<ref-unite ref='S51IN1M2' role='' />
		<ref-unite ref='S51IN1M3' role='' />
		<ref-unite ref='S51IN1M4' role='' />
		<ref-unite ref='S51IN1M5' role='' />
		<ref-unite ref='S51IN1M6' role='' />
		<ref-unite ref='S51PP1M2' role='' />
	</semestre>

	<semestre id='S2ILD'>
		<ref-unite ref='' />
		<ref-unite ref='' />
		<ref-unite ref='' />
		<ref-unite ref='' />
		<ref-unite ref='' />
		<ref-unite ref='' />
		<ref-unite ref='' />
		<ref-unite ref='' />
	</semestre>

	<semestre id='S2FSI'>
		<ref-unite ref='' />
		<ref-unite ref='' />
		<ref-unite ref='' />
		<ref-unite ref='' />
		<ref-unite ref='' />
		<ref-unite ref='' />
		<ref-unite ref='' />
		<ref-unite ref='' />
	</semestre>

	<semestre id='S3ILD'>
		<ref-unite ref='' />
		<ref-unite ref='' />
		<ref-unite ref='' />
		<ref-unite ref='' />
		<ref-unite ref='' />
		<ref-unite ref='' />
		<ref-unite ref='' />
		<ref-unite ref='' />
	</semestre>

	<semestre id='S3FSI'>
		<ref-unite ref='' />
		<ref-unite ref='' />
		<ref-unite ref='' />
		<ref-unite ref='' />
		<ref-unite ref='' />
		<ref-unite ref='' />
		<ref-unite ref='' />
		<ref-unite ref='' />
	</semestre>



	<unite id='UE45'>
		<nom>XML</nom>
		<credit>6</credit>
		<resume>Blabla</resume>
		<plan>
			<chapitre>xml</chapitre>
			<chapitre>dtd</chapitre>
		</plan>
		<lieu>&campus;</lieu>
		<ref-intervenant ref='I1' />
	</unite>

	<unite id='UE46'>
		<nom>fiabilite</nom>
		<credit>6</credit>
		<resume>Blabla</resume>
		<plan>
			<chapitre>xml</chapitre>
			<chapitre>dtd</chapitre>
		</plan>
		<lieu>Luminy</lieu>
		<ref-intervenant ref='I2' />
		<ref-intervenant ref='I3' />
	</unite>
</master>